outputs/pretrained/test_classification_report.csv

,precision,recall,f1-score,support
KL0,0.6776859504132231,0.4385026737967914,0.5324675324675324,187.0
KL1,0.24183006535947713,0.43023255813953487,0.30962343096234307,86.0
KL2,0.39814814814814814,0.34959349593495936,0.3722943722943723,123.0
KL3,0.4444444444444444,0.5901639344262295,0.5070422535211268,61.0
KL4,0.875,0.5,0.6363636363636364,14.0
accuracy,0.43524416135881105,0.43524416135881105,0.43524416135881105,0.43524416135881105
macro avg,0.5274217216730586,0.461698532459503,0.47155824512180217,471.0
weighted avg,0.500760067264376,0.43524416135881105,0.44974505265451703,471.0

README.md

#### Interpretation

- **KL0:** Relatively high precision (67.77%), but recall is only 43.85%.
- **KL1:** Lowest precision (24.18%), indicating many incorrect KL1 predictions.
- **KL2:** Lowest recall (34.96%), indicating difficulty identifying actual KL2 images.
- **KL3:** Highest recall (59.02%), but precision is 44.44%.
- **KL4:** Highest precision (87.50%), but recall is only 50.00%. The model correctly identified 7 of the 14 actual KL4 images.